{
  "applicability": [
    {
      "benchmarks": [
        {
          "name": "ism_non_classified",
          "severity": null
        },
        {
          "name": "ism_official_sensitive",
          "severity": null
        },
        {
          "name": "ism_protected",
          "severity": null
        },
        {
          "name": "ism_secret",
          "severity": null
        },
        {
          "name": "ism_top_secret",
          "severity": null
        }
      ],
      "target": null,
      "version": null
    }
  ],
  "architecture": null,
  "assessment": {
    "manual_reason": "no_check",
    "status": "manual"
  },
  "check": null,
  "discussion": "To ensure that access to encrypted data is not lost due to the loss, damage or failure of an encryption key, it is important that where practical cryptographic equipment, applications and libraries provide a means of data recovery.",
  "discussion_format": "markdown",
  "id": "asd_ism.ism-0455",
  "odv": null,
  "references": {},
  "remediation": null,
  "schema_version": 5,
  "section_path": [
    "Guidelines for cryptography",
    "Cryptographic fundamentals",
    "Data recovery"
  ],
  "source": {
    "commit_sha": "9f77120a7f8671c73da02431cdc299fac264edab",
    "license": {
      "modified": true,
      "name": "CC BY 4.0",
      "rights_holder": "Commonwealth of Australia (Australian Signals Directorate)",
      "url": "https://creativecommons.org/licenses/by/4.0/"
    },
    "name": "asd_ism",
    "release_tag": "v2026.09.4",
    "upstream_path": "ISM_catalog.json",
    "upstream_revision": "5",
    "upstream_rule_id": "ism-0455",
    "upstream_updated": "Sep-25",
    "upstream_url": "https://github.com/AustralianCyberSecurityCentre/ism-oscal/blob/9f77120a7f8671c73da02431cdc299fac264edab/ISM_catalog.json"
  },
  "tags": [],
  "title": "Where practical, cryptographic equipment, applications and libraries provide a means of data recovery to allow for circumstances where the encryption key is unavailable due to loss, damage or failure."
}
