{
  "applicability": [
    {
      "benchmarks": [
        {
          "name": "ism_non_classified",
          "severity": null
        },
        {
          "name": "ism_official_sensitive",
          "severity": null
        },
        {
          "name": "ism_protected",
          "severity": null
        },
        {
          "name": "ism_secret",
          "severity": null
        },
        {
          "name": "ism_top_secret",
          "severity": null
        }
      ],
      "target": null,
      "version": null
    }
  ],
  "architecture": null,
  "assessment": {
    "manual_reason": "no_check",
    "status": "manual"
  },
  "check": null,
  "discussion": "Microsoft Entra Connect is responsible for synchronising identity information between Microsoft AD DS and Microsoft Entra ID services within hybrid on-premises and cloud-based environments. As such, particular care should be taken to secure servers that perform this role.",
  "discussion_format": "markdown",
  "id": "asd_ism.ism-1950",
  "odv": null,
  "references": {},
  "remediation": null,
  "schema_version": 5,
  "section_path": [
    "Guidelines for system hardening",
    "Server application hardening",
    "Microsoft Entra Connect"
  ],
  "source": {
    "commit_sha": "9f77120a7f8671c73da02431cdc299fac264edab",
    "license": {
      "modified": true,
      "name": "CC BY 4.0",
      "rights_holder": "Commonwealth of Australia (Australian Signals Directorate)",
      "url": "https://creativecommons.org/licenses/by/4.0/"
    },
    "name": "asd_ism",
    "release_tag": "v2026.09.4",
    "upstream_path": "ISM_catalog.json",
    "upstream_revision": "0",
    "upstream_rule_id": "ism-1950",
    "upstream_updated": "Sep-24",
    "upstream_url": "https://github.com/AustralianCyberSecurityCentre/ism-oscal/blob/9f77120a7f8671c73da02431cdc299fac264edab/ISM_catalog.json"
  },
  "tags": [],
  "title": "Soft matching between Microsoft AD DS and Microsoft Entra ID is disabled following initial synchronisation activities."
}
