{
  "applicability": [
    {
      "benchmarks": [
        {
          "name": "ism_non_classified",
          "severity": null
        },
        {
          "name": "ism_official_sensitive",
          "severity": null
        },
        {
          "name": "ism_protected",
          "severity": null
        },
        {
          "name": "ism_secret",
          "severity": null
        },
        {
          "name": "ism_top_secret",
          "severity": null
        },
        {
          "name": "e8_ml3",
          "severity": null
        }
      ],
      "target": null,
      "version": null
    }
  ],
  "architecture": null,
  "assessment": {
    "manual_reason": "no_check",
    "status": "manual"
  },
  "check": null,
  "discussion": "Event log monitoring is critical to maintaining the security posture of systems. It involves the timely analysis of event logs to detect cyber security events and identify potential cyber security incidents. In doing so, successful detection of cyber security events, and identification of cyber security incidents, requires trained cyber security personnel with access to sufficient tools that support manual and automated analysis of system behaviour.",
  "discussion_format": "markdown",
  "id": "asd_ism.ism-1907",
  "odv": null,
  "references": {},
  "remediation": null,
  "schema_version": 5,
  "section_path": [
    "Guidelines for security assurance",
    "Security monitoring",
    "Event log monitoring"
  ],
  "source": {
    "commit_sha": "9f77120a7f8671c73da02431cdc299fac264edab",
    "license": {
      "modified": true,
      "name": "CC BY 4.0",
      "rights_holder": "Commonwealth of Australia (Australian Signals Directorate)",
      "url": "https://creativecommons.org/licenses/by/4.0/"
    },
    "name": "asd_ism",
    "release_tag": "v2026.09.4",
    "upstream_path": "ISM_catalog.json",
    "upstream_revision": "0",
    "upstream_rule_id": "ism-1907",
    "upstream_updated": "Dec-23",
    "upstream_url": "https://github.com/AustralianCyberSecurityCentre/ism-oscal/blob/9f77120a7f8671c73da02431cdc299fac264edab/ISM_catalog.json"
  },
  "tags": [],
  "title": "Event logs from non-internet-facing servers are analysed in a timely manner to detect cyber security events."
}
