{
  "applicability": [
    {
      "benchmarks": [
        {
          "name": "ism_non_classified",
          "severity": null
        },
        {
          "name": "ism_official_sensitive",
          "severity": null
        },
        {
          "name": "ism_protected",
          "severity": null
        },
        {
          "name": "ism_secret",
          "severity": null
        },
        {
          "name": "ism_top_secret",
          "severity": null
        }
      ],
      "target": null,
      "version": null
    }
  ],
  "architecture": null,
  "assessment": {
    "manual_reason": "no_check",
    "status": "manual"
  },
  "check": null,
  "discussion": "Applications and workloads may require credentials to authenticate to systems, services and data repositories without direct human involvement. Where such credentials are long-lived or reused by multiple applications, workloads or operating environments, their compromise can provide malicious actors with persistent access to systems and increase the extent of a compromise.\n\nApplications and workloads should use short-lived dynamically issued credentials in preference to long-lived static credentials. Where static credentials are required, centrally managing them using a credential or secrets management solution can assist with their secure storage, access control and lifecycle management. In addition, applications and workloads should use unique credentials that are not shared with other applications or workloads, or across development, testing, staging and production environments.",
  "discussion_format": "markdown",
  "id": "asd_ism.ism-2141",
  "odv": null,
  "references": {},
  "remediation": null,
  "schema_version": 5,
  "section_path": [
    "Guidelines for system access",
    "Credential management",
    "Application and workload credentials"
  ],
  "source": {
    "commit_sha": "9f77120a7f8671c73da02431cdc299fac264edab",
    "license": {
      "modified": true,
      "name": "CC BY 4.0",
      "rights_holder": "Commonwealth of Australia (Australian Signals Directorate)",
      "url": "https://creativecommons.org/licenses/by/4.0/"
    },
    "name": "asd_ism",
    "release_tag": "v2026.09.4",
    "upstream_path": "ISM_catalog.json",
    "upstream_revision": "0",
    "upstream_rule_id": "ism-2141",
    "upstream_updated": "Sep-26",
    "upstream_url": "https://github.com/AustralianCyberSecurityCentre/ism-oscal/blob/9f77120a7f8671c73da02431cdc299fac264edab/ISM_catalog.json"
  },
  "tags": [],
  "title": "Applications and workloads use short-lived dynamically issued credentials in preference to long-lived static credentials."
}
