{
  "applicability": [
    {
      "benchmarks": [
        {
          "name": "ism_non_classified",
          "severity": null
        },
        {
          "name": "ism_official_sensitive",
          "severity": null
        },
        {
          "name": "ism_protected",
          "severity": null
        },
        {
          "name": "ism_secret",
          "severity": null
        },
        {
          "name": "ism_top_secret",
          "severity": null
        },
        {
          "name": "e8_ml3",
          "severity": null
        }
      ],
      "target": null,
      "version": null
    }
  ],
  "architecture": null,
  "assessment": {
    "manual_reason": "no_check",
    "status": "manual"
  },
  "check": null,
  "discussion": "When office productivity suites, such as Microsoft Office, are deployed in their default state, or with an unapproved configuration, it can lead to an insecure operating environment that may allow malicious actors to gain an initial foothold on networks. Many settings exist within office productivity suites enabling them to be configured in an approved secure state to minimise this security risk. As such, ASD and vendors often produce hardening guidance to assist in hardening the configuration of office productivity suites. However, in situations where ASD and vendor hardening guidance conflicts, precedence should be given to implementing the most restrictive guidance.\n\nIn addition, human users’ ability to change the security settings of office productivity suites can be exploited by malicious actors using social engineering. To prevent human users from removing security functionality, or breaking security functionality, human users should not have the ability to change security settings for office productivity suites.\n\nFinally, Microsoft Office files can contain embedded code, known as a macro, written in the Visual Basic for Applications programming language. A macro can contain a series of commands that can be coded or recorded and replayed later to automate repetitive tasks. Macros are powerful tools that can be easily created by human users to improve their productivity. However, malicious actors can also create macros to perform a variety of malicious activities, such as assisting to compromise workstations to exfiltrate or deny access to data. To reduce this security risk, an organisation should disable Microsoft Office macros for human users that do not have a demonstrated business requirement and secure their use for those that do.",
  "discussion_format": "markdown",
  "id": "asd_ism.ism-1487",
  "odv": null,
  "references": {},
  "remediation": null,
  "schema_version": 5,
  "section_path": [
    "Guidelines for system hardening",
    "User application hardening",
    "Office productivity suites"
  ],
  "source": {
    "commit_sha": "9f77120a7f8671c73da02431cdc299fac264edab",
    "license": {
      "modified": true,
      "name": "CC BY 4.0",
      "rights_holder": "Commonwealth of Australia (Australian Signals Directorate)",
      "url": "https://creativecommons.org/licenses/by/4.0/"
    },
    "name": "asd_ism",
    "release_tag": "v2026.09.4",
    "upstream_path": "ISM_catalog.json",
    "upstream_revision": "3",
    "upstream_rule_id": "ism-1487",
    "upstream_updated": "Sep-26",
    "upstream_url": "https://github.com/AustralianCyberSecurityCentre/ism-oscal/blob/9f77120a7f8671c73da02431cdc299fac264edab/ISM_catalog.json"
  },
  "tags": [],
  "title": "Only privileged human users responsible for checking that Microsoft Office macros are free of malicious code can write to and modify content within Trusted Locations."
}
