{
  "applicability": [
    {
      "benchmarks": [
        {
          "name": "ism_non_classified",
          "severity": null
        },
        {
          "name": "ism_official_sensitive",
          "severity": null
        },
        {
          "name": "ism_protected",
          "severity": null
        },
        {
          "name": "ism_secret",
          "severity": null
        },
        {
          "name": "ism_top_secret",
          "severity": null
        }
      ],
      "target": null,
      "version": null
    }
  ],
  "architecture": null,
  "assessment": {
    "manual_reason": "no_check",
    "status": "manual"
  },
  "check": null,
  "discussion": "In addition to the general requirement for users to be uniquely identifiable, assigning each AI agent its own unique identity ensures that actions taken by an AI agent can be distinguished from actions taken directly by a user on whose behalf it acts, as well as from actions taken by other AI agents. In doing so, identities assigned to AI agents should be managed in a similar manner to service accounts, including being disabled or removed when no longer required. Where an AI agent is assigned multiple identities, such as across different environments or platforms, all identities should be recorded in an organisation’s AI agent register.",
  "discussion_format": "markdown",
  "id": "asd_ism.ism-2133",
  "odv": null,
  "references": {},
  "remediation": null,
  "schema_version": 5,
  "section_path": [
    "Guidelines for system access",
    "Identity and access management",
    "Artificial intelligence agent identification"
  ],
  "source": {
    "commit_sha": "9f77120a7f8671c73da02431cdc299fac264edab",
    "license": {
      "modified": true,
      "name": "CC BY 4.0",
      "rights_holder": "Commonwealth of Australia (Australian Signals Directorate)",
      "url": "https://creativecommons.org/licenses/by/4.0/"
    },
    "name": "asd_ism",
    "release_tag": "v2026.09.4",
    "upstream_path": "ISM_catalog.json",
    "upstream_revision": "0",
    "upstream_rule_id": "ism-2133",
    "upstream_updated": "Sep-26",
    "upstream_url": "https://github.com/AustralianCyberSecurityCentre/ism-oscal/blob/9f77120a7f8671c73da02431cdc299fac264edab/ISM_catalog.json"
  },
  "tags": [],
  "title": "Each AI agent is assigned a unique identity that is distinct from the user accounts of personnel and the identities of other AI agents."
}
