{
  "applicability": [
    {
      "benchmarks": [
        {
          "name": "ism_top_secret",
          "severity": null
        }
      ],
      "target": null,
      "version": null
    }
  ],
  "architecture": null,
  "assessment": {
    "manual_reason": "no_check",
    "status": "manual"
  },
  "check": null,
  "discussion": "The use of designated wall outlet box colours can provide an easy way to distinguish wall outlet boxes for SECRET and TOP SECRET systems from wall outlet boxes for other systems. For example, while SECRET and TOP SECRET wall outlet boxes have designated wall outlet box colours, wall outlet boxes for other systems may be any colour except for those reserved for SECRET and TOP SECRET systems. In addition, wall outlet box colours for other systems, such as non-classified, OFFICIAL: Sensitive and PROTECTED systems, may use the same colour, such as blue. Ideally, wall outlet boxes should be the same colour that is used for associated cabling.",
  "discussion_format": "markdown",
  "id": "asd_ism.ism-1721",
  "odv": null,
  "references": {},
  "remediation": null,
  "schema_version": 5,
  "section_path": [
    "Guidelines for communications infrastructure",
    "Cabling infrastructure",
    "Wall outlet box colours"
  ],
  "source": {
    "commit_sha": "9f77120a7f8671c73da02431cdc299fac264edab",
    "license": {
      "modified": true,
      "name": "CC BY 4.0",
      "rights_holder": "Commonwealth of Australia (Australian Signals Directorate)",
      "url": "https://creativecommons.org/licenses/by/4.0/"
    },
    "name": "asd_ism",
    "release_tag": "v2026.09.4",
    "upstream_path": "ISM_catalog.json",
    "upstream_revision": "0",
    "upstream_rule_id": "ism-1721",
    "upstream_updated": "Dec-21",
    "upstream_url": "https://github.com/AustralianCyberSecurityCentre/ism-oscal/blob/9f77120a7f8671c73da02431cdc299fac264edab/ISM_catalog.json"
  },
  "tags": [],
  "title": "TOP SECRET wall outlet boxes are coloured red."
}
