{
  "applicability": [
    {
      "benchmarks": [],
      "target": "macOS",
      "version": "27.0"
    }
  ],
  "architecture": null,
  "assessment": {
    "manual_reason": null,
    "status": "automated"
  },
  "check": {
    "macOS": {
      "by_version": {},
      "default": {
        "additional_info": null,
        "result": {
          "type": "string",
          "value": "PASS"
        },
        "shell": "/usr/bin/osascript -l JavaScript -e 'var s = $.NSUserDefaults.alloc.initWithSuiteName(\"com.apple.applicationaccess\"); (ObjC.unwrap(s.objectForKey(\"allowDefinitionLookup\")) == false && s.objectIsForcedForKey(\"allowDefinitionLookup\")) ? \"PASS\" : \"FAIL\"'"
      },
      "language": "bash"
    }
  },
  "discussion": "The iOS device _MUST_ be configured not use the spell check feature of the OS.\n",
  "discussion_format": "asciidoc",
  "id": "mscp.os_definition_lookup_disable",
  "odv": null,
  "references": {
    "bsi": {
      "indigo": {
        "ios_17": [
          "ANNEX K"
        ],
        "ios_18": [
          "ANNEX K"
        ],
        "ios_26": [
          "ANNEX K"
        ]
      }
    },
    "disa": {
      "cmmc": [
        "AC.L1-B.1.III",
        "AC.L2-3.1.20",
        "CM.L2-3.4.6",
        "CM.L2-3.4.7"
      ]
    },
    "hhs": {
      "hicp": [
        "2.L.A"
      ]
    },
    "nist": {
      "800-53r5": [
        "AC-20",
        "AC-20(1)",
        "CM-7",
        "CM-7(1)"
      ],
      "cce": {
        "ios_17": [
          "CCE-93474-5"
        ],
        "ios_18": [
          "CCE-94521-2"
        ],
        "ios_26": [
          "CCE-95454-5"
        ],
        "ios_27": [
          "CCE-97301-6"
        ],
        "macos_27": [
          "CCE-97015-2"
        ]
      }
    }
  },
  "remediation": {
    "macOS": {
      "payloads": [
        {
          "data": [
            {
              "PayloadContent": [
                {
                  "allowDefinitionLookup": false
                }
              ],
              "PayloadType": "com.apple.applicationaccess"
            }
          ],
          "kind": "mobileconfig",
          "versions": null
        }
      ],
      "steps": []
    }
  },
  "schema_version": 5,
  "section_path": [
    "os"
  ],
  "source": {
    "commit_sha": "c1e6cf9c41d518d0456ab6a7f12a1a4d1f227715",
    "license": {
      "modified": true,
      "name": "CC BY 4.0",
      "rights_holder": "NIST macOS Security Compliance Project contributors",
      "url": "https://creativecommons.org/licenses/by/4.0/"
    },
    "name": "mscp",
    "release_tag": "release_27.0",
    "upstream_path": "rules/os/os_definition_lookup_disable.yaml",
    "upstream_revision": null,
    "upstream_rule_id": "os_definition_lookup_disable",
    "upstream_updated": null,
    "upstream_url": "https://github.com/usnistgov/macos_security/blob/c1e6cf9c41d518d0456ab6a7f12a1a4d1f227715/src/mscp/data/rules/os/os_definition_lookup_disable.yaml"
  },
  "tags": [
    "800-53r5_high",
    "800-53r5_low",
    "800-53r5_moderate",
    "cmmc_lvl1",
    "cmmc_lvl2",
    "cmmc_lvl3",
    "cnssi-1253_high",
    "cnssi-1253_low",
    "cnssi-1253_moderate",
    "hicp_lp"
  ],
  "title": "Disable Definition Lookup on the Device"
}
