{
  "applicability": [
    {
      "benchmarks": [
        {
          "name": "ism_non_classified",
          "severity": null
        },
        {
          "name": "ism_official_sensitive",
          "severity": null
        },
        {
          "name": "ism_protected",
          "severity": null
        },
        {
          "name": "ism_secret",
          "severity": null
        },
        {
          "name": "ism_top_secret",
          "severity": null
        }
      ],
      "target": null,
      "version": null
    }
  ],
  "architecture": null,
  "assessment": {
    "manual_reason": "no_check",
    "status": "manual"
  },
  "check": null,
  "discussion": "The integrity of evidence gathered during an investigation is maintained by investigators:\n\n- recording all their actions\n- maintaining a proper chain of custody\n- following all instructions provided by relevant law enforcement agencies.\n\nWhen gathering evidence following a cyber security incident, it is important that it is gathered in an appropriate manner and that its integrity is maintained. In addition, if ASD is requested to assist with investigations, no actions that could affect the integrity of evidence should be carried out before ASD becomes involved.",
  "discussion_format": "markdown",
  "id": "asd_ism.ism-0138",
  "odv": null,
  "references": {},
  "remediation": null,
  "schema_version": 5,
  "section_path": [
    "Guidelines for cyber security incidents",
    "Responding to cyber security incidents",
    "Maintaining the integrity of evidence"
  ],
  "source": {
    "commit_sha": "9f77120a7f8671c73da02431cdc299fac264edab",
    "license": {
      "modified": true,
      "name": "CC BY 4.0",
      "rights_holder": "Commonwealth of Australia (Australian Signals Directorate)",
      "url": "https://creativecommons.org/licenses/by/4.0/"
    },
    "name": "asd_ism",
    "release_tag": "v2026.09.4",
    "upstream_path": "ISM_catalog.json",
    "upstream_revision": "6",
    "upstream_rule_id": "ism-0138",
    "upstream_updated": "Jun-26",
    "upstream_url": "https://github.com/AustralianCyberSecurityCentre/ism-oscal/blob/9f77120a7f8671c73da02431cdc299fac264edab/ISM_catalog.json"
  },
  "tags": [],
  "title": "The integrity of evidence gathered during an investigation is maintained by investigators:"
}
