{
  "applicability": [
    {
      "benchmarks": [],
      "target": "macOS",
      "version": "27.0"
    }
  ],
  "architecture": null,
  "assessment": {
    "manual_reason": null,
    "status": "automated"
  },
  "check": {
    "macOS": {
      "by_version": {},
      "default": {
        "additional_info": null,
        "result": {
          "type": "string",
          "value": "PASS"
        },
        "shell": "/usr/bin/osascript -l JavaScript -e 'var s = $.NSUserDefaults.alloc.initWithSuiteName(\"com.apple.applicationaccess\"); (ObjC.unwrap(s.objectForKey(\"allowScreenShot\")) == false && s.objectIsForcedForKey(\"allowScreenShot\")) ? \"PASS\" : \"FAIL\"'"
      },
      "language": "bash"
    }
  },
  "discussion": "Screenshots and screen recordings _MUST_ be disabled.\n",
  "discussion_format": "asciidoc",
  "id": "mscp.os_screenshots_disable",
  "odv": null,
  "references": {
    "bsi": {
      "indigo": {
        "ios_17": [
          "ANNEX K"
        ],
        "ios_18": [
          "ANNEX K"
        ],
        "ios_26": [
          "ANNEX K"
        ]
      }
    },
    "cis": {
      "benchmark": {
        "ios_17": [
          "3.2.1.1 (level 2 - Institutionally-Owned Devices)"
        ],
        "ios_18": [
          "3.2.1.1 (level 2 - Institutionally-Owned Devices)"
        ],
        "ios_26": [
          "3.2.1.1 (level 2 - Institutionally-Owned Devices)"
        ]
      },
      "controls_v8": [
        "3.3"
      ]
    },
    "disa": {
      "cci": [
        "CCI-000366"
      ],
      "cmmc": [
        "CM.L2-3.4.6",
        "CM.L2-3.4.7"
      ],
      "disa_stig": {
        "ios_26": [
          "AIOS-26-018000"
        ],
        "visionos_26": [
          "AVOS-26-018000"
        ]
      },
      "sfr": [
        "FMT_MOF_EXT.1.2 #47"
      ]
    },
    "hhs": {
      "hicp": [
        "2.L.A",
        "4.L.A",
        "4.L.B"
      ]
    },
    "nist": {
      "800-53r5": [
        "CM-7",
        "CM-7(1)",
        "SC-7(10)"
      ],
      "cce": {
        "ios_17": [
          "CCE-93446-3"
        ],
        "ios_18": [
          "CCE-94463-7"
        ],
        "ios_26": [
          "CCE-95521-1"
        ],
        "ios_27": [
          "CCE-97378-4"
        ],
        "macos_27": [
          "CCE-97076-4"
        ],
        "visionos_26": [
          "CCE-95592-2"
        ],
        "visionos_27": [
          "CCE-97465-9"
        ]
      }
    }
  },
  "remediation": {
    "macOS": {
      "payloads": [
        {
          "data": [
            {
              "PayloadContent": [
                {
                  "allowScreenShot": false
                }
              ],
              "PayloadType": "com.apple.applicationaccess"
            }
          ],
          "kind": "mobileconfig",
          "versions": null
        }
      ],
      "steps": []
    }
  },
  "schema_version": 5,
  "section_path": [
    "os"
  ],
  "source": {
    "commit_sha": "c1e6cf9c41d518d0456ab6a7f12a1a4d1f227715",
    "license": {
      "modified": true,
      "name": "CC BY 4.0",
      "rights_holder": "NIST macOS Security Compliance Project contributors",
      "url": "https://creativecommons.org/licenses/by/4.0/"
    },
    "name": "mscp",
    "release_tag": "release_27.0",
    "upstream_path": "rules/os/os_screenshots_disable.yaml",
    "upstream_revision": null,
    "upstream_rule_id": "os_screenshots_disable",
    "upstream_updated": null,
    "upstream_url": "https://github.com/usnistgov/macos_security/blob/c1e6cf9c41d518d0456ab6a7f12a1a4d1f227715/src/mscp/data/rules/os/os_screenshots_disable.yaml"
  },
  "tags": [
    "800-53r5_high",
    "800-53r5_low",
    "800-53r5_moderate",
    "cisv8",
    "cmmc_lvl2",
    "cmmc_lvl3",
    "cnssi-1253_high",
    "cnssi-1253_low",
    "cnssi-1253_moderate",
    "hicp_lp"
  ],
  "title": "Ensure Allow Screenshots and Screen Recording is Set to Disabled"
}
