{
  "applicability": [
    {
      "benchmarks": [
        {
          "name": "ism_non_classified",
          "severity": null
        },
        {
          "name": "ism_official_sensitive",
          "severity": null
        },
        {
          "name": "ism_protected",
          "severity": null
        },
        {
          "name": "ism_secret",
          "severity": null
        },
        {
          "name": "ism_top_secret",
          "severity": null
        }
      ],
      "target": null,
      "version": null
    }
  ],
  "architecture": null,
  "assessment": {
    "manual_reason": "no_check",
    "status": "manual"
  },
  "check": null,
  "discussion": "SPF aids in the detection of spoofed emails by specifying a list of hosts or Internet Protocol (IP) addresses that are allowed to send emails on behalf of a specified domain or subdomain. If an email server is not in the SPF record for a domain or subdomain, SPF verification will not pass. In specifying SPF records, domain owners should ensure that they delegate the minimum necessary set of hosts or IP addresses necessary for sending emails. In addition, extra care should be taken when delegating to hosts or IP addresses not under an organisation’s control.",
  "discussion_format": "markdown",
  "id": "asd_ism.ism-1183",
  "odv": null,
  "references": {},
  "remediation": null,
  "schema_version": 5,
  "section_path": [
    "Guidelines for email",
    "Email gateways and servers",
    "Sender Policy Framework"
  ],
  "source": {
    "commit_sha": "9f77120a7f8671c73da02431cdc299fac264edab",
    "license": {
      "modified": true,
      "name": "CC BY 4.0",
      "rights_holder": "Commonwealth of Australia (Australian Signals Directorate)",
      "url": "https://creativecommons.org/licenses/by/4.0/"
    },
    "name": "asd_ism",
    "release_tag": "v2026.09.4",
    "upstream_path": "ISM_catalog.json",
    "upstream_revision": "3",
    "upstream_rule_id": "ism-1183",
    "upstream_updated": "Jun-23",
    "upstream_url": "https://github.com/AustralianCyberSecurityCentre/ism-oscal/blob/9f77120a7f8671c73da02431cdc299fac264edab/ISM_catalog.json"
  },
  "tags": [],
  "title": "A hard fail SPF record is used when specifying authorised email servers (or lack thereof) for an organisation’s domains (including subdomains)."
}
