{
  "applicability": [
    {
      "benchmarks": [
        {
          "name": "ism_non_classified",
          "severity": null
        },
        {
          "name": "ism_official_sensitive",
          "severity": null
        },
        {
          "name": "ism_protected",
          "severity": null
        },
        {
          "name": "ism_secret",
          "severity": null
        },
        {
          "name": "ism_top_secret",
          "severity": null
        }
      ],
      "target": null,
      "version": null
    }
  ],
  "architecture": null,
  "assessment": {
    "manual_reason": "no_check",
    "status": "manual"
  },
  "check": null,
  "discussion": "If malicious actors have reduced opportunities to connect unauthorised network devices, or networked information technology (IT) equipment, to networks, they also have reduced opportunities to compromise such networks. Network access controls can not only prevent unauthorised access to networks, but also prevent personnel from carelessly bridging networks by connecting one network to another network. Furthermore, network access controls can also be useful for limiting the flow of network traffic between network segments.",
  "discussion_format": "markdown",
  "id": "asd_ism.ism-1182",
  "odv": null,
  "references": {},
  "remediation": null,
  "schema_version": 5,
  "section_path": [
    "Guidelines for networking",
    "Network design and configuration",
    "Network access controls"
  ],
  "source": {
    "commit_sha": "9f77120a7f8671c73da02431cdc299fac264edab",
    "license": {
      "modified": true,
      "name": "CC BY 4.0",
      "rights_holder": "Commonwealth of Australia (Australian Signals Directorate)",
      "url": "https://creativecommons.org/licenses/by/4.0/"
    },
    "name": "asd_ism",
    "release_tag": "v2026.09.4",
    "upstream_path": "ISM_catalog.json",
    "upstream_revision": "5",
    "upstream_rule_id": "ism-1182",
    "upstream_updated": "Sep-23",
    "upstream_url": "https://github.com/AustralianCyberSecurityCentre/ism-oscal/blob/9f77120a7f8671c73da02431cdc299fac264edab/ISM_catalog.json"
  },
  "tags": [],
  "title": "Network access controls are implemented to limit the flow of network traffic within and between network segments to only that required for business purposes."
}
