{
  "applicability": [
    {
      "benchmarks": [
        {
          "name": "ism_non_classified",
          "severity": null
        },
        {
          "name": "ism_official_sensitive",
          "severity": null
        },
        {
          "name": "ism_protected",
          "severity": null
        },
        {
          "name": "ism_secret",
          "severity": null
        },
        {
          "name": "ism_top_secret",
          "severity": null
        },
        {
          "name": "e8_ml3",
          "severity": null
        }
      ],
      "target": null,
      "version": null
    }
  ],
  "architecture": null,
  "assessment": {
    "manual_reason": "no_check",
    "status": "manual"
  },
  "check": null,
  "discussion": "To mitigate the security risk of backups being accidentally or maliciously modified or deleted, an organisation should ensure that backups are sufficiently protected from unauthorised modification and deletion by using appropriate access controls during their retention period. Furthermore, as malicious actors routinely seek to access backup infrastructure using credentials harvested from production environments, backup infrastructure should be segregated from such environments and use a separate authentication mechanism for administrative access.",
  "discussion_format": "markdown",
  "id": "asd_ism.ism-1708",
  "odv": null,
  "references": {},
  "remediation": null,
  "schema_version": 5,
  "section_path": [
    "Guidelines for system management",
    "Data backup and restoration",
    "Backup modification and deletion"
  ],
  "source": {
    "commit_sha": "9f77120a7f8671c73da02431cdc299fac264edab",
    "license": {
      "modified": true,
      "name": "CC BY 4.0",
      "rights_holder": "Commonwealth of Australia (Australian Signals Directorate)",
      "url": "https://creativecommons.org/licenses/by/4.0/"
    },
    "name": "asd_ism",
    "release_tag": "v2026.09.4",
    "upstream_path": "ISM_catalog.json",
    "upstream_revision": "2",
    "upstream_rule_id": "ism-1708",
    "upstream_updated": "Dec-23",
    "upstream_url": "https://github.com/AustralianCyberSecurityCentre/ism-oscal/blob/9f77120a7f8671c73da02431cdc299fac264edab/ISM_catalog.json"
  },
  "tags": [],
  "title": "Backup administrator accounts are prevented from modifying and deleting backups during their retention period."
}
