{
  "applicability": [
    {
      "benchmarks": [
        {
          "name": "disa_stig",
          "severity": "high"
        }
      ],
      "target": "macOS",
      "version": "15.0"
    },
    {
      "benchmarks": [
        {
          "name": "disa_stig",
          "severity": "high"
        }
      ],
      "target": "macOS",
      "version": "26.0"
    },
    {
      "benchmarks": [
        {
          "name": "disa_stig",
          "severity": "high"
        }
      ],
      "target": "macOS",
      "version": "27.0"
    }
  ],
  "architecture": null,
  "assessment": {
    "manual_reason": null,
    "status": "automated"
  },
  "check": {
    "macOS": {
      "by_version": {},
      "default": {
        "additional_info": null,
        "result": {
          "type": "integer",
          "value": 2
        },
        "shell": "/usr/sbin/sshd -G | /usr/bin/grep -Ec '^(passwordauthentication\\s+no|kbdinteractiveauthentication\\s+no)'"
      },
      "language": "bash"
    }
  },
  "discussion": "If remote login through SSH is enabled, password based authentication _MUST_ be disabled for user login.\n\nAll users _MUST_ go through multifactor authentication to prevent unauthenticated access and potential compromise to the system.\n\nNOTE: /etc/ssh/sshd_config will be automatically modified to its original state following any update or major upgrade to the operating system.\n",
  "discussion_format": "asciidoc",
  "id": "mscp.auth_ssh_password_authentication_disable",
  "odv": null,
  "references": {
    "cis": {
      "controls_v8": [
        "6.3",
        "6.4",
        "6.5"
      ]
    },
    "disa": {
      "cci": [
        "CCI-000186",
        "CCI-000765",
        "CCI-000766",
        "CCI-000767",
        "CCI-000768",
        "CCI-000877",
        "CCI-001941",
        "CCI-001948",
        "CCI-004046"
      ],
      "cmmc": [
        "IA.L1-3.5.1",
        "IA.L1-3.5.2",
        "IA.L2-3.5.3",
        "IA.L2-3.5.4",
        "MA.L2-3.7.5"
      ],
      "disa_stig": {
        "macos_14": [
          "APPL-14-001150"
        ],
        "macos_15": [
          "APPL-15-001150"
        ],
        "macos_26": [
          "APPL-26-001150"
        ],
        "macos_27": [
          "APPL-27-001150"
        ]
      },
      "srg": [
        "SRG-OS-000107-GPOS-00054",
        "SRG-OS-000112-GPOS-00057",
        "SRG-OS-000067-GPOS-00035",
        "SRG-OS-000108-GPOS-00055",
        "SRG-OS-000125-GPOS-00065",
        "SRG-OS-000106-GPOS-00053",
        "SRG-OS-000375-GPOS-00160",
        "SRG-OS-000105-GPOS-00052"
      ]
    },
    "hhs": {
      "hicp": [
        "3.L.B",
        "6.L.B"
      ]
    },
    "nist": {
      "800-171r3": [
        "03.05.01",
        "03.05.03",
        "03.05.04",
        "03.07.05"
      ],
      "800-53r5": [
        "IA-2(1)",
        "IA-2(2)",
        "IA-2(6)",
        "IA-2",
        "IA-5(2)",
        "MA-4",
        "IA-2(8)"
      ],
      "cce": {
        "macos_14": [
          "CCE-92739-2"
        ],
        "macos_15": [
          "CCE-94139-3"
        ],
        "macos_26": [
          "CCE-95139-2"
        ],
        "macos_27": [
          "CCE-96984-0"
        ]
      }
    }
  },
  "remediation": {
    "macOS": {
      "payloads": [
        {
          "data": {
            "config_file": "sshd_config",
            "configuration_key": "KbdInteractiveAuthentication",
            "configuration_value": false,
            "declarationtype": "com.apple.configuration.services.configuration-files",
            "service": "com.apple.sshd"
          },
          "kind": "ddm",
          "versions": null
        }
      ],
      "steps": [
        {
          "additional_info": null,
          "language": "bash",
          "name": null,
          "shell": "include_dir=$(/usr/bin/awk '/^Include/ {print $2}' /etc/ssh/sshd_config | /usr/bin/tr -d '*')\nif [[ -z $include_dir ]]; then\n  /usr/bin/sed -i.bk \"1s/.*/Include \\/etc\\/ssh\\/sshd_config.d\\/\\*/\" /etc/ssh/sshd_config\nfi\necho \"passwordauthentication no\" >> \"${include_dir}01-mscp-sshd.conf\"\necho \"kbdinteractiveauthentication no\" >> \"${include_dir}01-mscp-sshd.conf\"\n\nfor file in $(ls ${include_dir}); do\n  if [[ \"$file\" == \"100-macos.conf\" ]]; then\n      continue\n  fi\n  if [[ \"$file\" == \"01-mscp-sshd.conf\" ]]; then\n      break\n  fi\n  /bin/mv ${include_dir}${file} ${include_dir}20-${file}\ndone",
          "versions": null
        }
      ]
    }
  },
  "schema_version": 5,
  "section_path": [
    "auth"
  ],
  "source": {
    "commit_sha": "c1e6cf9c41d518d0456ab6a7f12a1a4d1f227715",
    "license": {
      "modified": true,
      "name": "CC BY 4.0",
      "rights_holder": "NIST macOS Security Compliance Project contributors",
      "url": "https://creativecommons.org/licenses/by/4.0/"
    },
    "name": "mscp",
    "release_tag": "release_27.0",
    "upstream_path": "rules/auth/auth_ssh_password_authentication_disable.yaml",
    "upstream_revision": null,
    "upstream_rule_id": "auth_ssh_password_authentication_disable",
    "upstream_updated": null,
    "upstream_url": "https://github.com/usnistgov/macos_security/blob/c1e6cf9c41d518d0456ab6a7f12a1a4d1f227715/src/mscp/data/rules/auth/auth_ssh_password_authentication_disable.yaml"
  },
  "tags": [
    "800-171",
    "800-53r5_high",
    "800-53r5_low",
    "800-53r5_moderate",
    "cisv8",
    "cmmc_lvl1",
    "cmmc_lvl2",
    "cnssi-1253_high",
    "cnssi-1253_low",
    "cnssi-1253_moderate",
    "hicp_lp"
  ],
  "title": "Disable Password Authentication for SSH"
}
