{
  "applicability": [
    {
      "benchmarks": [
        {
          "name": "ism_non_classified",
          "severity": null
        },
        {
          "name": "ism_official_sensitive",
          "severity": null
        },
        {
          "name": "ism_protected",
          "severity": null
        }
      ],
      "target": null,
      "version": null
    }
  ],
  "architecture": null,
  "assessment": {
    "manual_reason": "no_check",
    "status": "manual"
  },
  "check": null,
  "discussion": "When identifying a suitable curve from NIST SP 800-186, a base point order and key size of at least 224 bits for correctly implemented ECDH provides 112 bits of effective security strength, with larger key sizes providing more bits of effective security strength. Security of a curve selected from another source cannot be assumed to have the same security using base point order and key size alone.\n\nTaking into account projected technological advances in quantum computing, ECDH will not be approved beyond 2030.",
  "discussion_format": "markdown",
  "id": "asd_ism.ism-0474",
  "odv": null,
  "references": {},
  "remediation": null,
  "schema_version": 5,
  "section_path": [
    "Guidelines for cryptography",
    "Cryptographic algorithms",
    "Using Elliptic Curve Diffie-Hellman"
  ],
  "source": {
    "commit_sha": "9f77120a7f8671c73da02431cdc299fac264edab",
    "license": {
      "modified": true,
      "name": "CC BY 4.0",
      "rights_holder": "Commonwealth of Australia (Australian Signals Directorate)",
      "url": "https://creativecommons.org/licenses/by/4.0/"
    },
    "name": "asd_ism",
    "release_tag": "v2026.09.4",
    "upstream_path": "ISM_catalog.json",
    "upstream_revision": "7",
    "upstream_rule_id": "ism-0474",
    "upstream_updated": "Dec-24",
    "upstream_url": "https://github.com/AustralianCyberSecurityCentre/ism-oscal/blob/9f77120a7f8671c73da02431cdc299fac264edab/ISM_catalog.json"
  },
  "tags": [],
  "title": "When using ECDH for agreeing on encryption session keys, a base point order and key size of at least 224 bits is used, preferably the NIST P-384 curve."
}
