{
  "applicability": [
    {
      "benchmarks": [
        {
          "name": "ism_non_classified",
          "severity": null
        },
        {
          "name": "ism_official_sensitive",
          "severity": null
        },
        {
          "name": "ism_protected",
          "severity": null
        },
        {
          "name": "ism_secret",
          "severity": null
        },
        {
          "name": "ism_top_secret",
          "severity": null
        }
      ],
      "target": null,
      "version": null
    }
  ],
  "architecture": null,
  "assessment": {
    "manual_reason": "no_check",
    "status": "manual"
  },
  "check": null,
  "discussion": "Floor plan diagrams that are developed using computer-aided design and drafting applications, and use alphanumeric grid referencing, can provide an accurate scaled view for each floor and are critical to ensuring that cabling infrastructure components can be easily located by installers and inspectors. In doing so, floor plan diagrams should track all cabling infrastructure changes throughout the life of a system.",
  "discussion_format": "markdown",
  "id": "asd_ism.ism-1645",
  "odv": null,
  "references": {},
  "remediation": null,
  "schema_version": 5,
  "section_path": [
    "Guidelines for communications infrastructure",
    "Cabling infrastructure",
    "Floor plan diagrams"
  ],
  "source": {
    "commit_sha": "9f77120a7f8671c73da02431cdc299fac264edab",
    "license": {
      "modified": true,
      "name": "CC BY 4.0",
      "rights_holder": "Commonwealth of Australia (Australian Signals Directorate)",
      "url": "https://creativecommons.org/licenses/by/4.0/"
    },
    "name": "asd_ism",
    "release_tag": "v2026.09.4",
    "upstream_path": "ISM_catalog.json",
    "upstream_revision": "3",
    "upstream_rule_id": "ism-1645",
    "upstream_updated": "Jun-26",
    "upstream_url": "https://github.com/AustralianCyberSecurityCentre/ism-oscal/blob/9f77120a7f8671c73da02431cdc299fac264edab/ISM_catalog.json"
  },
  "tags": [],
  "title": "Floor plan diagrams are developed, implemented, maintained and regularly verified."
}
