{
  "applicability": [
    {
      "benchmarks": [
        {
          "name": "ism_non_classified",
          "severity": null
        },
        {
          "name": "ism_official_sensitive",
          "severity": null
        },
        {
          "name": "ism_protected",
          "severity": null
        },
        {
          "name": "ism_secret",
          "severity": null
        },
        {
          "name": "ism_top_secret",
          "severity": null
        }
      ],
      "target": null,
      "version": null
    }
  ],
  "architecture": null,
  "assessment": {
    "manual_reason": "no_check",
    "status": "manual"
  },
  "check": null,
  "discussion": "An organisation transferring data between systems belonging to different security domains is strongly encouraged to use write-once media. When done properly, such as using non-rewritable compact discs that have been finalised, this ensures that data from the destination system cannot be accidentally transferred, or maliciously exfiltrated, onto the media and then onto another system. Alternatively, if suitable write-once media is not used, the destination system should have a mechanism through which read-only access can be ensured, such as via a read-only device or hardware write-blocker. However, the use of read-only mechanisms is not immune to failure or compromise. Therefore, rewritable media should still be sanitised following each data transfer.\n\nIt is important to note that for most non-volatile flash memory media, it will be possible to sanitise and reclassify it following a data transfer to allow it to be connected to other systems again. This is not possible for SECRET and TOP SECRET non-volatile flash memory media as it cannot be reclassified following sanitisation.",
  "discussion_format": "markdown",
  "id": "asd_ism.ism-0347",
  "odv": null,
  "references": {},
  "remediation": null,
  "schema_version": 5,
  "section_path": [
    "Guidelines for media",
    "Media usage",
    "Using media for data transfers"
  ],
  "source": {
    "commit_sha": "9f77120a7f8671c73da02431cdc299fac264edab",
    "license": {
      "modified": true,
      "name": "CC BY 4.0",
      "rights_holder": "Commonwealth of Australia (Australian Signals Directorate)",
      "url": "https://creativecommons.org/licenses/by/4.0/"
    },
    "name": "asd_ism",
    "release_tag": "v2026.09.4",
    "upstream_path": "ISM_catalog.json",
    "upstream_revision": "5",
    "upstream_rule_id": "ism-0347",
    "upstream_updated": "Apr-21",
    "upstream_url": "https://github.com/AustralianCyberSecurityCentre/ism-oscal/blob/9f77120a7f8671c73da02431cdc299fac264edab/ISM_catalog.json"
  },
  "tags": [],
  "title": "When transferring data manually between two systems belonging to different security domains, write-once media is used unless the destination system has a mechanism through which read-only access can be ensured."
}
