{
  "applicability": [
    {
      "benchmarks": [
        {
          "name": "ism_non_classified",
          "severity": null
        },
        {
          "name": "ism_official_sensitive",
          "severity": null
        },
        {
          "name": "ism_protected",
          "severity": null
        },
        {
          "name": "ism_secret",
          "severity": null
        },
        {
          "name": "ism_top_secret",
          "severity": null
        }
      ],
      "target": null,
      "version": null
    }
  ],
  "architecture": null,
  "assessment": {
    "manual_reason": "no_check",
    "status": "manual"
  },
  "check": null,
  "discussion": "Application control can be an effective way to both prevent malicious code from executing on workstations and servers and ensure only approved applications can execute. When developing application control rulesets, determining approved executables (e.g. .exe and .com files), libraries (e.g. .dll and.ocx files), scripts (e.g. .ps1, .bat, .cmd, .vbs and .js files), installers (e.g. .msi, .msp and .mst files), compiled HTML (e.g. .chm files), HTML applications (e.g. .hta files), control panel applets (e.g. .cpl files) and drivers based on business requirements is a more secure method than simply approving those already residing on a workstation or server. Furthermore, it is preferable that an organisation defines their own application control rulesets, rather than relying on those from application control vendors, and validate them at least annually.\n\nIn implementing application control, an organisation should use a reliable method, or combination of methods, such as cryptographic hash rules, publisher certificate rules or path rules. Depending on the method chosen, further hardening may be required to ensure that application control mechanisms and application control rulesets cannot be bypassed by malicious actors.\n\nFinally, centrally logging and analysing application control events can assist in monitoring the security posture of systems, detecting malicious behaviour and contributing to investigations following cyber security incidents.",
  "discussion_format": "markdown",
  "id": "asd_ism.ism-0955",
  "odv": null,
  "references": {},
  "remediation": null,
  "schema_version": 5,
  "section_path": [
    "Guidelines for system hardening",
    "Operating system hardening",
    "Application control"
  ],
  "source": {
    "commit_sha": "9f77120a7f8671c73da02431cdc299fac264edab",
    "license": {
      "modified": true,
      "name": "CC BY 4.0",
      "rights_holder": "Commonwealth of Australia (Australian Signals Directorate)",
      "url": "https://creativecommons.org/licenses/by/4.0/"
    },
    "name": "asd_ism",
    "release_tag": "v2026.09.4",
    "upstream_path": "ISM_catalog.json",
    "upstream_revision": "6",
    "upstream_rule_id": "ism-0955",
    "upstream_updated": "Apr-20",
    "upstream_url": "https://github.com/AustralianCyberSecurityCentre/ism-oscal/blob/9f77120a7f8671c73da02431cdc299fac264edab/ISM_catalog.json"
  },
  "tags": [],
  "title": "Application control is implemented using cryptographic hash rules, publisher certificate rules or path rules."
}
