{
  "applicability": [
    {
      "benchmarks": [
        {
          "name": "ism_top_secret",
          "severity": null
        }
      ],
      "target": null,
      "version": null
    }
  ],
  "architecture": null,
  "assessment": {
    "manual_reason": "no_check",
    "status": "manual"
  },
  "check": null,
  "discussion": "Physical separation between TOP SECRET systems and non-TOP SECRET systems reduces the chance of cross-patching. This reduces the possibility of unauthorised personnel gaining access to TOP SECRET systems.",
  "discussion_format": "markdown",
  "id": "asd_ism.ism-1116",
  "odv": null,
  "references": {},
  "remediation": null,
  "schema_version": 5,
  "section_path": [
    "Guidelines for communications infrastructure",
    "Cabling infrastructure",
    "Physical separation of cabinets and patch panels"
  ],
  "source": {
    "commit_sha": "9f77120a7f8671c73da02431cdc299fac264edab",
    "license": {
      "modified": true,
      "name": "CC BY 4.0",
      "rights_holder": "Commonwealth of Australia (Australian Signals Directorate)",
      "url": "https://creativecommons.org/licenses/by/4.0/"
    },
    "name": "asd_ism",
    "release_tag": "v2026.09.4",
    "upstream_path": "ISM_catalog.json",
    "upstream_revision": "4",
    "upstream_rule_id": "ism-1116",
    "upstream_updated": "Mar-23",
    "upstream_url": "https://github.com/AustralianCyberSecurityCentre/ism-oscal/blob/9f77120a7f8671c73da02431cdc299fac264edab/ISM_catalog.json"
  },
  "tags": [],
  "title": "A visible gap exists between TOP SECRET cabinets and non-TOP SECRET cabinets."
}
