{
  "applicability": [
    {
      "benchmarks": [
        {
          "name": "ism_non_classified",
          "severity": null
        },
        {
          "name": "ism_official_sensitive",
          "severity": null
        },
        {
          "name": "ism_protected",
          "severity": null
        },
        {
          "name": "ism_secret",
          "severity": null
        },
        {
          "name": "ism_top_secret",
          "severity": null
        }
      ],
      "target": null,
      "version": null
    }
  ],
  "architecture": null,
  "assessment": {
    "manual_reason": "no_check",
    "status": "manual"
  },
  "check": null,
  "discussion": "Microsoft AD DS domain controllers hold sensitive data for systems, such as hashed credentials for all user accounts. As such, particular care should be taken to secure these servers. This can be achieved by hardening their configuration while using dedicated domain administrator user accounts exclusively for their administration. In doing so, technical security controls should ensure these dedicated domain administrator user accounts cannot be used to connect to or administer other systems.",
  "discussion_format": "markdown",
  "id": "asd_ism.ism-1829",
  "odv": null,
  "references": {},
  "remediation": null,
  "schema_version": 5,
  "section_path": [
    "Guidelines for system hardening",
    "Server application hardening",
    "Microsoft Active Directory Domain Services"
  ],
  "source": {
    "commit_sha": "9f77120a7f8671c73da02431cdc299fac264edab",
    "license": {
      "modified": true,
      "name": "CC BY 4.0",
      "rights_holder": "Commonwealth of Australia (Australian Signals Directorate)",
      "url": "https://creativecommons.org/licenses/by/4.0/"
    },
    "name": "asd_ism",
    "release_tag": "v2026.09.4",
    "upstream_path": "ISM_catalog.json",
    "upstream_revision": "1",
    "upstream_rule_id": "ism-1829",
    "upstream_updated": "Sep-24",
    "upstream_url": "https://github.com/AustralianCyberSecurityCentre/ism-oscal/blob/9f77120a7f8671c73da02431cdc299fac264edab/ISM_catalog.json"
  },
  "tags": [],
  "title": "Passwords are not stored in Group Policy Preferences."
}
